{
  "$schema": "https://json-schema.org/draft/2020-12/schema",
  "$id": "https://github.com/kvetinski/paraflow/blob/main/contracts/workload-v1.schema.json",
  "title": "ParaFlow workload v1",
  "description": "Logical workload semantics independent of execution backend and physical layout.",
  "type": "object",
  "additionalProperties": false,
  "required": [
    "schema_version",
    "name",
    "dataset",
    "pipeline"
  ],
  "properties": {
    "$schema": {
      "type": [
        "string",
        "null"
      ]
    },
    "schema_version": {
      "const": "paraflow.workload/v1"
    },
    "name": {
      "type": "string",
      "minLength": 1,
      "maxLength": 120,
      "pattern": "\\S"
    },
    "dataset": {
      "$ref": "#/$defs/dataset"
    },
    "pipeline": {
      "$ref": "#/$defs/pipeline"
    }
  },
  "$defs": {
    "dataset": {
      "type": "object",
      "additionalProperties": false,
      "required": [
        "record_count",
        "seed",
        "generator",
        "distribution",
        "feature_min",
        "feature_max",
        "category_count",
        "flag_probability_bps"
      ],
      "properties": {
        "record_count": {
          "type": "integer",
          "minimum": 0,
          "maximum": 18446744073709551615
        },
        "seed": {
          "type": "integer",
          "minimum": 0,
          "maximum": 18446744073709551615
        },
        "generator": {
          "const": "splitmix64-v1"
        },
        "distribution": {
          "oneOf": [
            {
              "type": "object",
              "additionalProperties": false,
              "required": [
                "kind"
              ],
              "properties": {
                "kind": {
                  "const": "uniform"
                }
              }
            },
            {
              "type": "object",
              "additionalProperties": false,
              "required": [
                "kind",
                "category",
                "probability_bps"
              ],
              "properties": {
                "kind": {
                  "const": "hotspot"
                },
                "category": {
                  "type": "integer",
                  "minimum": 0,
                  "maximum": 4294967295
                },
                "probability_bps": {
                  "type": "integer",
                  "minimum": 0,
                  "maximum": 10000
                }
              }
            }
          ]
        },
        "feature_min": {
          "type": "integer",
          "minimum": -2147483648,
          "maximum": 2147483647
        },
        "feature_max": {
          "type": "integer",
          "minimum": -2147483648,
          "maximum": 2147483647
        },
        "category_count": {
          "type": "integer",
          "minimum": 1,
          "maximum": 65536
        },
        "flag_probability_bps": {
          "type": "integer",
          "minimum": 0,
          "maximum": 10000
        }
      }
    },
    "pipeline": {
      "type": "object",
      "additionalProperties": false,
      "required": [
        "normalize",
        "score",
        "filter",
        "aggregate"
      ],
      "properties": {
        "normalize": {
          "$ref": "#/$defs/normalize"
        },
        "score": {
          "$ref": "#/$defs/score"
        },
        "filter": {
          "$ref": "#/$defs/filter"
        },
        "aggregate": {
          "$ref": "#/$defs/aggregate"
        }
      }
    },
    "normalize": {
      "type": "object",
      "additionalProperties": false,
      "required": [
        "offset_a",
        "scale_a",
        "offset_b",
        "scale_b",
        "clip"
      ],
      "properties": {
        "offset_a": {
          "$ref": "#/$defs/f32"
        },
        "scale_a": {
          "$ref": "#/$defs/positiveF32"
        },
        "offset_b": {
          "$ref": "#/$defs/f32"
        },
        "scale_b": {
          "$ref": "#/$defs/positiveF32"
        },
        "clip": {
          "$ref": "#/$defs/positiveF32"
        }
      }
    },
    "score": {
      "type": "object",
      "additionalProperties": false,
      "required": [
        "weight_a",
        "weight_b",
        "bias",
        "flag_mask",
        "flag_bonus"
      ],
      "properties": {
        "weight_a": {
          "$ref": "#/$defs/f32"
        },
        "weight_b": {
          "$ref": "#/$defs/f32"
        },
        "bias": {
          "$ref": "#/$defs/f32"
        },
        "flag_mask": {
          "type": "integer",
          "minimum": 0,
          "maximum": 4294967295
        },
        "flag_bonus": {
          "$ref": "#/$defs/f32"
        }
      }
    },
    "filter": {
      "type": "object",
      "additionalProperties": false,
      "required": [
        "min_score"
      ],
      "properties": {
        "min_score": {
          "$ref": "#/$defs/f32"
        }
      }
    },
    "aggregate": {
      "type": "object",
      "additionalProperties": false,
      "required": [
        "histogram"
      ],
      "properties": {
        "histogram": {
          "const": "category"
        }
      }
    },
    "f32": {
      "type": "number",
      "minimum": -3.4028234663852886e+38,
      "maximum": 3.4028234663852886e+38
    },
    "positiveF32": {
      "type": "number",
      "exclusiveMinimum": 0,
      "maximum": 3.4028234663852886e+38
    }
  }
}
